<?xml version="1.0" encoding="UTF-8" standalone="no"?>
<!DOCTYPE remotes SYSTEM "girr.dtd">
<remotes
         xmlns="http://www.harctoolbox.org/girr"
         xmlns:xsi="http://www.w3.org/2001/XMLSchema-instance"
         xmlns:html="http://www.w3.org/1999/xhtml">
         <!--xsi:schemaLocation="http://www.harctoolbox.org/girr http://www.harctoolbox.org/schemas/girr.xsd"-->
    <notes><html:p>This is <html:b>quite</html:b> nice.</html:p>
    </notes>
    <remote version="1.0" id="r1" name="tester" comment="just a test">
        <notes/>
        <application-data application="jp1">
            <notes/>
            <parameter name="setup-code" value="1234"/>
            <button-map>
                <button name="play" display-name="Play" unshifted="cmd1" shifted="stop" metashifted="record"/>
            </button-map>
        </application-data>
        <command-set id="c1" comment="">
            <notes/>
            <parameters id="p1" protocol="nec1">
                <parameter name="D" value="0"/>
            </parameters>
            <command id="cmd1" name="play" display-name="Play |>" comment="">
                <notes/>
                <parameters>
                    <parameter name="F" value="0"/>
                </parameters>
                <raw frequency="38400">
                    <intro>+9024 -4512 +564 -564 +564 -564 +564 -564 +564 -564 +564 <!-- no ids on sequences -->
                        -564 +564 -564 +564 -564 +564 -564 +564 -1692 +564 -1692 +564 -1692 +564 -1692
                        +564 -1692 +564 -1692 +564 -1692 +564 -1692 +564 -564 +564 -564 +564 -564 +564
                        -564 +564 -564 +564 -564 +564 -564 +564 -564 +564 -1692 +564 -1692 +564 -1692
                        +564 -1692 +564 -1692 +564 -1692 +564 -1692 +564 -1692 +564 -39756
                    </intro>
                    <repeat>+9024 -2256 +564 -96156</repeat>
                </raw>
                <ccf>0000 006C 0022 0002 015B 00AD 0016 0016 0016 0016 0016 0016 0016 0016 0016 0016 0016 0016 0016 0016 0016 0016 0016 0041 0016 0041 0016 0041 0016 0041 0016 0041 0016 0041 0016 0041 0016 0041 0016 0016 0016 0016 0016 0016 0016 0016 0016 0016 0016 0016 0016 0016 0016 0016 0016 0041 0016 0041 0016 0041 0016 0041 0016 0041 0016 0041 0016 0041 0016 0041 0016 05F7 015B 0057 0016 0E6C</ccf>
                <format name="uei-learned">00 00 2F 00 D0 06 11 A0 08 D0 01 1A 01 1A 01 1A 03 4E 01 1A 4D A6 11 A0 04 68 01 1A BB CE 22 01 11 11 11 12 22 22 22 21 11 11 11 12 22 22 22 23 82 45</format>
            </command>
            <command F="1" name="stop">
                <raw>
                    <intro>
                        <flash>9024</flash>
                        <gap>4512</gap>
                        <flash>564</flash>
                        <gap>564</gap>
                        <flash>564</flash>
                        <gap>564</gap>
                        <flash>564</flash>
                        <gap>564</gap>
                        <flash>564</flash>
                        <gap>564</gap>
                        <flash>564</flash>
                        <gap>564</gap>
                        <flash>564</flash>
                        <gap>564</gap>
                        <flash>564</flash>
                        <gap>564</gap>
                        <flash>564</flash>
                        <gap>564</gap>
                        <flash>564</flash>
                        <gap>1692</gap>
                        <flash>564</flash>
                        <gap>1692</gap>
                        <flash>564</flash>
                        <gap>1692</gap>
                        <flash>564</flash>
                        <gap>1692</gap>
                        <flash>564</flash>
                        <gap>1692</gap>
                        <flash>564</flash>
                        <gap>1692</gap>
                        <flash>564</flash>
                        <gap>1692</gap>
                        <flash>564</flash>
                        <gap>1692</gap>
                        <flash>564</flash>
                        <gap>1692</gap>
                        <flash>564</flash>
                        <gap>564</gap>
                        <flash>564</flash>
                        <gap>564</gap>
                        <flash>564</flash>
                        <gap>564</gap>
                        <flash>564</flash>
                        <gap>564</gap>
                        <flash>564</flash>
                        <gap>564</gap>
                        <flash>564</flash>
                        <gap>564</gap>
                        <flash>564</flash>
                        <gap>564</gap>
                        <flash>564</flash>
                        <gap>564</gap>
                        <flash>564</flash>
                        <gap>1692</gap>
                        <flash>564</flash>
                        <gap>1692</gap>
                        <flash>564</flash>
                        <gap>1692</gap>
                        <flash>564</flash>
                        <gap>1692</gap>
                        <flash>564</flash>
                        <gap>1692</gap>
                        <flash>564</flash>
                        <gap>1692</gap>
                        <flash>564</flash>
                        <gap>1692</gap>
                        <flash>564</flash>
                        <gap>39756</gap>
                    </intro>
                    <repeat>
                        <flash>9024</flash>
                        <gap>2256</gap>
                        <flash>564</flash>
                        <gap>96156</gap>
                    </repeat>
                </raw>
                <ccf>0000 006C 0022 0002 015B 00AD 0016 0016 0016 0016 0016 0016 0016 0016 0016 0016 0016 0016 0016 0016 0016 0016 0016 0041 0016 0041 0016 0041 0016 0041 0016 0041 0016 0041 0016 0041 0016 0041 0016 0041 0016 0016 0016 0016 0016 0016 0016 0016 0016 0016 0016 0016 0016 0016 0016 0016 0016 0041 0016 0041 0016 0041 0016 0041 0016 0041 0016 0041 0016 0041 0016 05F7 015B 0057 0016 0E6C</ccf>
                <format name="uei-learned">00 00 2F 00 D0 06 11 A0 08 D0 01 1A 01 1A 01 1A 03 4E 01 1A 4D A6 11 A0 04 68 01 1A BB CE 22 01 11 11 11 12 22 22 22 22 11 11 11 11 22 22 22 23 82 45</format>
            </command>
            <command F="2" name="record">
                <raw>
                    <intro>
                        <flash>9024</flash>
                        <gap>4512</gap>
                        <flash>564</flash>
                        <gap>564</gap>
                        <flash>564</flash>
                        <gap>564</gap>
                        <flash>564</flash>
                        <gap>564</gap>
                        <flash>564</flash>
                        <gap>564</gap>
                        <flash>564</flash>
                        <gap>564</gap>
                        <flash>564</flash>
                        <gap>564</gap>
                        <flash>564</flash>
                        <gap>564</gap>
                        <flash>564</flash>
                        <gap>564</gap>
                        <flash>564</flash>
                        <gap>1692</gap>
                        <flash>564</flash>
                        <gap>1692</gap>
                        <flash>564</flash>
                        <gap>1692</gap>
                        <flash>564</flash>
                        <gap>1692</gap>
                        <flash>564</flash>
                        <gap>1692</gap>
                        <flash>564</flash>
                        <gap>1692</gap>
                        <flash>564</flash>
                        <gap>1692</gap>
                        <flash>564</flash>
                        <gap>1692</gap>
                        <flash>564</flash>
                        <gap>564</gap>
                        <flash>564</flash>
                        <gap>1692</gap>
                        <flash>564</flash>
                        <gap>564</gap>
                        <flash>564</flash>
                        <gap>564</gap>
                        <flash>564</flash>
                        <gap>564</gap>
                        <flash>564</flash>
                        <gap>564</gap>
                        <flash>564</flash>
                        <gap>564</gap>
                        <flash>564</flash>
                        <gap>564</gap>
                        <flash>564</flash>
                        <gap>1692</gap>
                        <flash>564</flash>
                        <gap>564</gap>
                        <flash>564</flash>
                        <gap>1692</gap>
                        <flash>564</flash>
                        <gap>1692</gap>
                        <flash>564</flash>
                        <gap>1692</gap>
                        <flash>564</flash>
                        <gap>1692</gap>
                        <flash>564</flash>
                        <gap>1692</gap>
                        <flash>564</flash>
                        <gap>1692</gap>
                        <flash>564</flash>
                        <gap>39756</gap>
                    </intro>
                    <repeat>
                        <flash>9024</flash>
                        <gap>2256</gap>
                        <flash>564</flash>
                        <gap>96156</gap>
                    </repeat>
                </raw>
                <ccf>0000 006C 0022 0002 015B 00AD 0016 0016 0016 0016 0016 0016 0016 0016 0016 0016 0016 0016 0016 0016 0016 0016 0016 0041 0016 0041 0016 0041 0016 0041 0016 0041 0016 0041 0016 0041 0016 0041 0016 0016 0016 0041 0016 0016 0016 0016 0016 0016 0016 0016 0016 0016 0016 0016 0016 0041 0016 0016 0016 0041 0016 0041 0016 0041 0016 0041 0016 0041 0016 0041 0016 05F7 015B 0057 0016 0E6C</ccf>